{
  "schema_version": "1.0.0",
  "protocol_version": "1.2",
  "id": "completed-cycle",
  "description": "A completed bounded cycle is exported as a successful integration event.",
  "required": true,
  "records": [
    {
      "record_type": "completed-cycle",
      "timestamp": "2026-09-12T18:00:00Z",
      "source_id": "benchmark-cycle-1",
      "success": true,
      "evidence": ["synthetic benchmark evidence"]
    }
  ],
  "expected": {
    "event_count": 1,
    "event_types": ["integration"],
    "outcomes": ["success"],
    "forbidden_values": []
  }
}
