{
  "schema_version": "1.0.0",
  "protocol_version": "1.2",
  "id": "empty-source",
  "description": "An empty native data directory produces an empty valid export.",
  "required": true,
  "records": [],
  "expected": {
    "event_count": 0,
    "event_types": [],
    "outcomes": [],
    "forbidden_values": []
  }
}
