{
  "schema_version": "1.0.0",
  "protocol_version": "1.2",
  "id": "missing-id-private-fields",
  "description": "A record without an ID receives a stable ID and does not expose synthetic private fields.",
  "required": true,
  "records": [
    {
      "record_type": "completed-cycle",
      "timestamp": "2026-09-12T18:02:00Z",
      "success": true,
      "evidence": ["privacy fixture"],
      "private_values": {
        "prompt": "BENCHMARK_PRIVATE_PROMPT_91C6",
        "session": "BENCHMARK_PRIVATE_SESSION_44A2",
        "command_output": "BENCHMARK_PRIVATE_OUTPUT_9E10"
      }
    }
  ],
  "expected": {
    "event_count": 1,
    "event_types": ["integration"],
    "outcomes": ["success"],
    "forbidden_values": [
      "BENCHMARK_PRIVATE_PROMPT_91C6",
      "BENCHMARK_PRIVATE_SESSION_44A2",
      "BENCHMARK_PRIVATE_OUTPUT_9E10"
    ]
  }
}
